[
  {
    "id": "ujjwala-connections",
    "title": "Coverage side of a pair, present without its usage counterpart",
    "unit": "crore connections",
    "domain": "welfare",
    "tier": "T1",
    "source": { "name": "Fixture, not a real source", "url": "https://example.org/" },
    "calendar": "FY",
    "points": [{ "country": "IND", "period": "FY2025-26", "value": 10.3, "status": "approx" }]
  }
]
