[
  {
    "id": "rate-without-its-base",
    "title": "A rate carrying the denominator dispute and stating no base",
    "unit": "percent",
    "domain": "governance",
    "tier": "T1",
    "source": { "name": "Fixture, not a real source", "url": "https://example.org/" },
    "calendar": "CY",
    "provenanceRefs": ["P-52"],
    "denominator": null,
    "points": [{ "country": "IND", "period": "2023", "value": 3.0, "status": "approx" }]
  },
  {
    "id": "count-carrying-the-same-record",
    "title": "A count carrying the same record, which must NOT trip the rule",
    "unit": "count",
    "domain": "governance",
    "tier": "T1",
    "source": { "name": "Fixture, not a real source", "url": "https://example.org/" },
    "calendar": "CY",
    "provenanceRefs": ["P-52"],
    "points": [{ "country": "IND", "period": "2023", "value": 15, "status": "approx" }]
  }
]
