[
  {
    "id": "paired-series-with-absence",
    "title": "A paired series whose declared absence its own page does not render",
    "unit": "%",
    "domain": "welfare",
    "tier": "T1",
    "source": { "name": "Fixture, not a real source", "url": "https://example.org/" },
    "calendar": "CY",
    "notes": "Notes render on the record page, so the fixture fails on the absence alone.",
    "unmeasured": [
      {
        "what": "The counterpart nobody measures on this fixture series",
        "why": "Declared in data and suppressed on the record page by a pair view that no longer pools it, which is the exact shape of the phase 6c regression.",
        "reasonKind": "not-collected"
      }
    ],
    "points": [{ "country": "IND", "period": "2024", "value": 50, "status": "approx" }]
  }
]
