[
  {
    "id": "metro-network",
    "title": "Coverage series whose pair stands its usage side on an absence it never declares",
    "unit": "km",
    "domain": "infrastructure",
    "tier": "T1",
    "source": { "name": "Fixture, not a real source", "url": "https://example.org/" },
    "calendar": "FY",
    "points": [{ "country": "IND", "period": "FY2025-26", "value": 1013, "status": "approx" }]
  }
]
