[
  {
    "id": "lensed-series-off-its-lens-page",
    "title": "A series whose lens surface exists but does not carry it",
    "unit": "count",
    "domain": "defence",
    "lenses": [
      "kashmir"
    ],
    "tier": "T1",
    "source": {
      "name": "Fixture, not a real source",
      "url": "https://example.org/"
    },
    "calendar": "FY",
    "points": [
      {
        "country": "IND",
        "period": "FY2013-14",
        "value": 1,
        "status": "verified"
      }
    ]
  }
]
