[
  {
    "id": "all-lens-series",
    "title": "Fixture series carrying every lens value, so lens-empty cannot fire and the missing page is the only branch left",
    "unit": "count",
    "domain": "foreign",
    "tier": "T1",
    "source": {
      "name": "Fixture, not a real source",
      "url": "https://example.org/"
    },
    "calendar": "FY",
    "points": [
      {
        "country": "IND",
        "period": "FY2013-14",
        "value": 1,
        "status": "verified"
      }
    ],
    "lenses": [
      "kashmir",
      "federalism",
      "defence-sector",
      "united-states",
      "russia"
    ]
  }
]
