[
  {
    "id": "gdp-growth-old-base",
    "title": "Regime one, ending at FY2013-14",
    "unit": "% y/y",
    "domain": "macro",
    "tier": "T1",
    "source": { "name": "Fixture, not a real source", "url": "https://example.org/" },
    "calendar": "FY",
    "points": [{ "country": "IND", "period": "FY2013-14", "value": 4.7, "status": "approx" }]
  },
  {
    "id": "gdp-growth-new-base",
    "title": "Regime two, beginning three years later, leaving a hole",
    "unit": "% y/y",
    "domain": "macro",
    "tier": "T1",
    "source": { "name": "Fixture, not a real source", "url": "https://example.org/" },
    "calendar": "FY",
    "points": [{ "country": "IND", "period": "FY2016-17", "value": 8.3, "status": "approx" }]
  },
  {
    "id": "gdp-growth-2022-base",
    "title": "Regime three, contiguous with regime two",
    "unit": "% y/y",
    "domain": "macro",
    "tier": "T1",
    "source": { "name": "Fixture, not a real source", "url": "https://example.org/" },
    "calendar": "FY",
    "points": [{ "country": "IND", "period": "FY2016-17", "value": 7.2, "status": "approx" }]
  }
]
