[
  {
    "id": "jjm-tap-coverage",
    "title": "Coverage side of the JJM pair, called a corrective by P-92",
    "unit": "% of rural households",
    "domain": "infrastructure",
    "tier": "T1",
    "source": { "name": "Fixture, not a real source", "url": "https://example.org/" },
    "calendar": "FY",
    "provenanceRefs": ["P-92"],
    "points": [{ "country": "IND", "period": "FY2025-26", "value": 82, "status": "approx" }]
  },
  {
    "id": "jjm-functionality",
    "title": "Usage side of the JJM pair, called affected by P-92",
    "unit": "% of certified households",
    "domain": "infrastructure",
    "tier": "T1",
    "source": { "name": "Fixture, not a real source", "url": "https://example.org/" },
    "calendar": "FY",
    "provenanceRefs": ["P-92"],
    "points": [{ "country": "IND", "period": "FY2024-25", "value": 76, "status": "approx" }]
  }
]
