[
  {
    "id": "fixture-series",
    "title": "Fixture series, not a real record",
    "unit": "count",
    "domain": "foreign",
    "tier": "T1",
    "source": {
      "name": "Fixture, not a real source",
      "url": "https://example.org/"
    },
    "calendar": "FY",
    "points": [
      {
        "country": "IND",
        "period": "FY2013-14",
        "value": 1,
        "status": "verified"
      }
    ]
  }
]
