[
  {
    "id": "unemployment-rate",
    "title": "One instrument of a contested pair, present without the survey that disagrees with it",
    "unit": "% of labour force",
    "domain": "employment",
    "tier": "T1",
    "source": { "name": "Fixture, not a real source", "url": "https://example.org/" },
    "calendar": "FY",
    "points": [{ "country": "IND", "period": "FY2023-24", "value": 3.2, "status": "approx" }]
  }
]
