[
  {
    "id": "cannot-be-both",
    "title": "Series listed on both sides of the mirror by P-90",
    "unit": "% y/y",
    "domain": "macro",
    "tier": "T1",
    "source": { "name": "Fixture, not a real source", "url": "https://example.org/" },
    "calendar": "FY",
    "provenanceRefs": ["P-90"],
    "points": [{ "country": "IND", "period": "FY2020-21", "value": 1.5, "status": "approx" }]
  }
]
